{
  "schema_version": "1",
  "tool_version": "0.1.0-dev",
  "lean_version": "4.30.0-rc2",
  "policy_identifier": "strict",
  "transparency_mode": "none",
  "summary": {
    "declarations_scanned": 3,
    "declarations_passed": 1,
    "declarations_warned": 0,
    "declarations_failed": 2,
    "declarations_with_unknown_nodes": 0,
    "schema_version": "1"
  },
  "reports": [
    {
      "schema_version": "1",
      "tool_version": "0.1.0-dev",
      "lean_version": "4.30.0-rc2",
      "report_model_version": "0.1.0-dev",
      "target": "Example.explicit",
      "declaration_kind": "theorem",
      "transparency_mode": "none",
      "policy_identifier": "strict",
      "policy_result": "fail",
      "unknowns_occurred": false,
      "cycles_truncated": false,
      "transparency_limited": false,
      "raw_declaration_type_repr": "explicit.baseline",
      "result_type_repr": "result",
      "assumption_tree": [
        {
          "name": "h",
          "binder_kind": "explicit",
          "primary_category": "direct_prop",
          "secondary_flags": [
            "binder_type_is_prop"
          ],
          "binder_type_repr": "sort(0)",
          "children": [],
          "renderer_children_truncated": false
        }
      ],
      "result_surface": null,
      "policy_findings": [
        {
          "kind": "unapproved_direct_prop",
          "severity": "failure",
          "path": [
            "h"
          ],
          "category": "direct_prop",
          "type_name": null
        }
      ],
      "limitations": [
        "audits elaborated declaration types only",
        "does not validate proof axioms",
        "does not sandbox Lean execution",
        "does not prove theorem-statement equivalence"
      ]
    },
    {
      "schema_version": "1",
      "tool_version": "0.1.0-dev",
      "lean_version": "4.30.0-rc2",
      "report_model_version": "0.1.0-dev",
      "target": "Example.hidden",
      "declaration_kind": "theorem",
      "transparency_mode": "none",
      "policy_identifier": "strict",
      "policy_result": "fail",
      "unknowns_occurred": false,
      "cycles_truncated": false,
      "transparency_limited": false,
      "raw_declaration_type_repr": "hidden.baseline",
      "result_type_repr": "result",
      "assumption_tree": [
        {
          "name": "pkg",
          "binder_kind": "explicit",
          "primary_category": "package_with_prop_fields",
          "secondary_flags": [],
          "binder_type_repr": "const(Example.Package,[])",
          "children": [],
          "renderer_children_truncated": false
        }
      ],
      "result_surface": null,
      "policy_findings": [
        {
          "kind": "unapproved_package_with_prop_fields",
          "severity": "failure",
          "path": [
            "pkg"
          ],
          "category": "package_with_prop_fields",
          "type_name": "Example.Package"
        }
      ],
      "limitations": [
        "audits elaborated declaration types only",
        "does not validate proof axioms",
        "does not sandbox Lean execution",
        "does not prove theorem-statement equivalence"
      ]
    },
    {
      "schema_version": "1",
      "tool_version": "0.1.0-dev",
      "lean_version": "4.30.0-rc2",
      "report_model_version": "0.1.0-dev",
      "target": "Example.removed",
      "declaration_kind": "theorem",
      "transparency_mode": "none",
      "policy_identifier": "strict",
      "policy_result": "pass",
      "unknowns_occurred": false,
      "cycles_truncated": false,
      "transparency_limited": false,
      "raw_declaration_type_repr": "removed.baseline",
      "result_type_repr": "result",
      "assumption_tree": [
        {
          "name": "n",
          "binder_kind": "explicit",
          "primary_category": "pure_data",
          "secondary_flags": [],
          "binder_type_repr": "const(Nat,[])",
          "children": [],
          "renderer_children_truncated": false
        }
      ],
      "result_surface": null,
      "policy_findings": [],
      "limitations": [
        "audits elaborated declaration types only",
        "does not validate proof axioms",
        "does not sandbox Lean execution",
        "does not prove theorem-statement equivalence"
      ]
    }
  ]
}
